{
  "$schema": "./schemas/product-decisions.schema.json",
  "schemaVersion": 1,
  "product": "MKD · Knowledge to Agent",
  "decisionSetId": "MKD-M1-A-B-C-2026-08-09",
  "frozenAt": "2026-08-09",
  "status": "owner-confirmed-design-baseline",
  "implementationAuthorization": {
    "state": "authorized-candidate-cloud",
    "authorizedAt": "2026-08-09",
    "phases": ["P0", "P1", "P2", "P3", "P4", "P5", "P6", "P7", "P8", "P9"],
    "allowed": [
      "isolated-worktree",
      "product-contracts",
      "architecture-decisions",
      "information-architecture",
      "high-fidelity-local-prototype",
      "schemas",
      "fixtures",
      "local-validation",
      "synthetic-multiformat-corpus",
      "structure-aware-extraction",
      "deterministic-compiler",
      "candidate-review-packets",
      "canonical-write-dry-run",
      "immutable-snapshot",
      "local-sqlite-index",
      "e2-deterministic-agent",
      "local-cli",
      "local-docker-compose",
      "stdio-mcp-adapter",
      "local-export-bundles",
      "reference-evidence-pages",
      "named-reviewer-intake",
      "candidate-static-artifact",
      "tencent-remote-readonly-preflight",
      "candidate-cloud-static-upload",
      "candidate-nginx-validation",
      "candidate-cloud-static-switch",
      "public-candidate-readback",
      "candidate-rollback"
    ],
    "forbiddenWithoutNewAuthorization": [
      "provider-call",
      "production-deploy",
      "canonical-knowledge-write",
      "external-send",
      "git-commit",
      "git-push",
      "package-publication"
    ]
  },
  "decisions": [
    { "id": "A", "value": "Guide + Reference Lab" },
    { "id": "A1-A2", "value": "AI 产品经理/知识工程负责人为主，工程师/架构师为辅" },
    { "id": "B1", "value": "多格式知识编译为旗舰任务" },
    { "id": "C1", "value": "公网固定语料只读演示 + 本地完整 Runner" },
    { "id": "D1", "value": "不可变 Replay 基线 + 限频 live 对比" },
    { "id": "E1", "value": "Amazon Ads 异常诊断首案" },
    { "id": "F2", "value": "只读检索 + 受控计算 + 行动草案", "mapsToExecutionLevel": "E2" },
    { "id": "G1", "value": "单任务 Agent + 确定性工具" },
    { "id": "H1-H2", "value": "任务成功优先，学习成功次之" },
    { "id": "I2", "value": "四角色独立验收" },
    { "id": "J1", "value": "公开 Schema/fixture/core Runner/golden tasks；私有语料、适配器、密钥、内部规则不公开" },
    { "id": "K1", "value": "MKD · Knowledge to Agent；Guide/Reference Lab/Cases/Evidence" },
    { "id": "L1", "value": "编辑出版感 × 工程实验室" },
    { "id": "M1", "value": "合同设计 → 离线 Reference → live/cloud 三段门禁" },
    { "id": "N1", "value": "腾讯云轻量服务器 + Docker Compose" },
    { "id": "O1", "value": "模型无关适配层，公开版本锁定单模型" },
    { "id": "P1", "value": "匿名浏览 + 签名会话/限频/预算/熔断" },
    { "id": "Q1", "value": "最小遥测；不保留自由文本" },
    { "id": "R1", "value": "保留 26 页，深改 8 个闭环模块" },
    { "id": "S1", "value": "4–6 个高密度固定多格式样本并含负例" },
    { "id": "T1", "value": "中文体验 + 英文一手来源/定位/版本" },
    { "id": "U1", "value": "行动包默认 + 工程证据展开" },
    { "id": "V1", "value": "Markdown/JSON/Receipt/Replay Bundle 导出" },
    { "id": "W1", "value": "反馈只生成 Observation/KnowledgeCandidate" },
    { "id": "X1", "value": "输入充分才输出精确数值，否则公式/区间/未知/停止" },
    { "id": "Y1", "value": "首页主 CTA 运行旗舰 Lab" },
    { "id": "Z1", "value": "Docker Compose quickstart + mkd CLI" },
    { "id": "AA1", "value": "Owner 做产品决策；Codex 实施；专业角色在门禁复核" }
  ]
}
